{
  "schema": "perfdigest.benchmark-result.v1",
  "createdAt": "2026-07-18T00:00:00Z",
  "manifest": {
    "id": "interpreter-matrix-2026-07-18",
    "path": "workloads/interpreter_matrix.py",
    "sha256": "2710c10d5aec5fe77f6fce9c30f1811372574b015a704c7e94b10cd14b323f70"
  },
  "subject": {
    "repo": "onlyxItachi/PerfDigest-MCP-Bench",
    "gitSha": "724af68faa7564cc134285789645776d562e94e1",
    "dirty": false,
    "ref": "perfdigest-mcp@76796f0 (v1.2.0-rc)"
  },
  "host": {
    "label": "amd-ryzen-ai-9-hx-370-x64",
    "os": "Linux 7.0.0-27-generic",
    "kernel": "7.0.0-27-generic",
    "arch": "x64",
    "cpuModel": "AMD Ryzen AI 9 HX 370 w/ Radeon 890M",
    "logicalCpus": 24,
    "memTotalKb": 14927160,
    "loadavg1AtStart": 0.84716796875
  },
  "tools": [
    {
      "name": "perfdigest-mcp",
      "version": "1.2.0-rc",
      "source": "onlyxItachi/PerfDigest-MCP@76796f0"
    },
    {
      "name": "uv",
      "version": "0.10.11",
      "source": "system"
    },
    {
      "name": "cpython-3.10",
      "version": "3.10.20",
      "source": "uv python install"
    },
    {
      "name": "cpython-3.11",
      "version": "3.11.15",
      "source": "uv python install"
    },
    {
      "name": "cpython-3.12",
      "version": "3.12.13",
      "source": "uv python install"
    },
    {
      "name": "cpython-3.13",
      "version": "3.13.12",
      "source": "uv python install"
    },
    {
      "name": "cpython-3.14",
      "version": "3.14.3",
      "source": "uv python install"
    },
    {
      "name": "cpython-3.14t",
      "version": "3.14.3+freethreaded",
      "source": "uv python install"
    }
  ],
  "mode": "full",
  "layerSummary": {
    "engine": {
      "total": 72,
      "measured": 72,
      "notRun": 0,
      "failed": 0,
      "parityPass": 72,
      "parityFail": 0,
      "parityNotApplicable": 0
    },
    "orchestration": {
      "total": 0,
      "measured": 0,
      "notRun": 0,
      "failed": 0,
      "parityPass": 0,
      "parityFail": 0,
      "parityNotApplicable": 0
    },
    "agent_e2e": {
      "total": 0,
      "measured": 0,
      "notRun": 0,
      "failed": 0,
      "parityPass": 0,
      "parityFail": 0,
      "parityNotApplicable": 0
    }
  },
  "benchCompatibility": {
    "upstreamRepo": "onlyxItachi/PerfDigest-MCP-Bench",
    "rawResultDirs": [
      "results/interpreter_matrix_raw",
      "results/cpp_build_loop_raw",
      "results/cuda_opt_bench_raw"
    ],
    "fieldMapping": {
      "latencyJson": "results/<backend>:<format>.{median_us,q1_us,q3_us,n} -> cells[layer=\"engine\"].wall.{unit:\"us\",median,q1,q3,n}",
      "identityJson": "results/<backend>:<format>.{sha256,bytes,total_units} -> cells[layer=\"engine\"].parity.checks[name=\"digest-sha256:<backend>:<format>\"]",
      "startupJson": "median_startup_s -> cells[layer=\"engine\",scenario=\"interpreter-startup\"].wall.{unit:\"s\",median}",
      "concurrencyJson": "{same_path_1thread,same_path_nthreads,mixed_paths_nthreads}.{wall_time_s,throughput_calls_per_s,correct} -> cells[layer=\"engine\"].extra.concurrency",
      "loadavgJson": "latency_loadavg.json -> host.loadavg1AtStart"
    }
  },
  "cells": [
    {
      "id": "engine.cpython-3.10.linux_perf.perf-stat-json",
      "layer": "engine",
      "group": "runtime",
      "backend": "cpython-3.10",
      "scenario": "digest-parse:linux_perf:perf-stat-json",
      "baseline": false,
      "status": "measured",
      "command": [
        "<venv-3.10>/bin/python",
        "workloads/interpreter_matrix.py",
        "worker",
        "--leg",
        "latency",
        "--repo",
        "<perfdigest-mcp-repo>"
      ],
      "method": "time.perf_counter() around backend.load_units(fixture), report_store cache bypassed, 5 warmups + 50 iterations",
      "warmup": 5,
      "wall": {
        "unit": "us",
        "n": 50,
        "median": 18.450002244208008,
        "min": 18.38000025600195,
        "max": 18.530001398175955,
        "mean": 18.450002244208008,
        "stdev": 0.1500011421740055,
        "q1": 18.38000025600195,
        "q3": 18.530001398175955
      },
      "memoryCoverage": "none",
      "parity": {
        "status": "pass",
        "checks": [
          {
            "name": "digest-sha256:linux_perf:perf-stat-json",
            "pass": true,
            "detail": "sha256=1384736cc101176f5802b1c5d4f7e20f26106ddc1aff1ac2098f98d1378660a3 bytes=599 total_units=1 matches_3.14=True"
          }
        ]
      },
      "extra": {
        "pythonVersion": "3.10.20",
        "iqrUs": 0.1500011421740055,
        "identity": {
          "sha256": "1384736cc101176f5802b1c5d4f7e20f26106ddc1aff1ac2098f98d1378660a3",
          "bytes": 599,
          "total_units": 1,
          "matchesGilBaseline": true
        }
      }
    },
    {
      "id": "engine.cpython-3.10.linux_perf.perf-report",
      "layer": "engine",
      "group": "runtime",
      "backend": "cpython-3.10",
      "scenario": "digest-parse:linux_perf:perf-report",
      "baseline": false,
      "status": "measured",
      "command": [
        "<venv-3.10>/bin/python",
        "workloads/interpreter_matrix.py",
        "worker",
        "--leg",
        "latency",
        "--repo",
        "<perfdigest-mcp-repo>"
      ],
      "method": "time.perf_counter() around backend.load_units(fixture), report_store cache bypassed, 5 warmups + 50 iterations",
      "warmup": 5,
      "wall": {
        "unit": "us",
        "n": 50,
        "median": 8.060000254772604,
        "min": 8.032500772969797,
        "max": 8.09999619377777,
        "mean": 8.060000254772604,
        "stdev": 0.06749542080797255,
        "q1": 8.032500772969797,
        "q3": 8.09999619377777
      },
      "memoryCoverage": "none",
      "parity": {
        "status": "pass",
        "checks": [
          {
            "name": "digest-sha256:linux_perf:perf-report",
            "pass": true,
            "detail": "sha256=d4a959e3f66def2fd67bc380d64c507aebacd0aaa037c59e9862c903d47943af bytes=1533 total_units=3 matches_3.14=True"
          }
        ]
      },
      "extra": {
        "pythonVersion": "3.10.20",
        "iqrUs": 0.06749542080797255,
        "identity": {
          "sha256": "d4a959e3f66def2fd67bc380d64c507aebacd0aaa037c59e9862c903d47943af",
          "bytes": 1533,
          "total_units": 3,
          "matchesGilBaseline": true
        }
      }
    },
    {
      "id": "engine.cpython-3.10.ptxas.ptxas-verbose",
      "layer": "engine",
      "group": "runtime",
      "backend": "cpython-3.10",
      "scenario": "digest-parse:ptxas:ptxas-verbose",
      "baseline": false,
      "status": "measured",
      "command": [
        "<venv-3.10>/bin/python",
        "workloads/interpreter_matrix.py",
        "worker",
        "--leg",
        "latency",
        "--repo",
        "<perfdigest-mcp-repo>"
      ],
      "method": "time.perf_counter() around backend.load_units(fixture), report_store cache bypassed, 5 warmups + 50 iterations",
      "warmup": 5,
      "wall": {
        "unit": "us",
        "n": 50,
        "median": 27.34999725362286,
        "min": 27.289999707136303,
        "max": 27.427497116150334,
        "mean": 27.34999725362286,
        "stdev": 0.1374974090140313,
        "q1": 27.289999707136303,
        "q3": 27.427497116150334
      },
      "memoryCoverage": "none",
      "parity": {
        "status": "pass",
        "checks": [
          {
            "name": "digest-sha256:ptxas:ptxas-verbose",
            "pass": true,
            "detail": "sha256=3bdf97458617ae08272a6cc925796459c414e766c2e69ad56457200f04caa636 bytes=1421 total_units=4 matches_3.14=True"
          }
        ]
      },
      "extra": {
        "pythonVersion": "3.10.20",
        "iqrUs": 0.1374974090140313,
        "identity": {
          "sha256": "3bdf97458617ae08272a6cc925796459c414e766c2e69ad56457200f04caa636",
          "bytes": 1421,
          "total_units": 4,
          "matchesGilBaseline": true
        }
      }
    },
    {
      "id": "engine.cpython-3.10.chrome_trace.torch-trace",
      "layer": "engine",
      "group": "runtime",
      "backend": "cpython-3.10",
      "scenario": "digest-parse:chrome_trace:torch-trace",
      "baseline": false,
      "status": "measured",
      "command": [
        "<venv-3.10>/bin/python",
        "workloads/interpreter_matrix.py",
        "worker",
        "--leg",
        "latency",
        "--repo",
        "<perfdigest-mcp-repo>"
      ],
      "method": "time.perf_counter() around backend.load_units(fixture), report_store cache bypassed, 5 warmups + 50 iterations",
      "warmup": 5,
      "wall": {
        "unit": "us",
        "n": 50,
        "median": 139.17049727751873,
        "min": 138.68500172975473,
        "max": 140.64324932405725,
        "mean": 139.17049727751873,
        "stdev": 1.9582475943025202,
        "q1": 138.68500172975473,
        "q3": 140.64324932405725
      },
      "memoryCoverage": "none",
      "parity": {
        "status": "pass",
        "checks": [
          {
            "name": "digest-sha256:chrome_trace:torch-trace",
            "pass": true,
            "detail": "sha256=caae0da348d989d33165033c32488591a8c1a5b729fbb17fff72a910f556a4c6 bytes=1191 total_units=15 matches_3.14=False"
          }
        ]
      },
      "extra": {
        "pythonVersion": "3.10.20",
        "iqrUs": 1.9582475943025202,
        "identity": {
          "sha256": "caae0da348d989d33165033c32488591a8c1a5b729fbb17fff72a910f556a4c6",
          "bytes": 1191,
          "total_units": 15,
          "matchesGilBaseline": false
        }
      }
    },
    {
      "id": "engine.cpython-3.10.clang_time_trace.clang-time-trace",
      "layer": "engine",
      "group": "runtime",
      "backend": "cpython-3.10",
      "scenario": "digest-parse:clang_time_trace:clang-time-trace",
      "baseline": false,
      "status": "measured",
      "command": [
        "<venv-3.10>/bin/python",
        "workloads/interpreter_matrix.py",
        "worker",